{
  "schema_version": 1,
  "generated_at": "2026-08-01T16:50:50+00:00",
  "n_repos": 28,
  "n_cloned": 28,
  "repos": [
    {
      "name": "Viva-munk",
      "repo": "Viva-munk",
      "source": "https://github.com/vivarium-collective/Viva-munk",
      "homepage": "https://github.com/vivarium-collective/Viva-munk",
      "description": "",
      "tags": [],
      "cloned": true,
      "processes": [
        {
          "name": "FieldDecay",
          "description": "",
          "ports": {
            "inputs": {
              "fields": "map[array]"
            },
            "outputs": {
              "fields": "map[array]"
            }
          }
        },
        {
          "name": "GrowDivide",
          "description": "",
          "ports": {
            "inputs": {
              "agent_id": "string",
              "agents": "map[pymunk_agent]"
            },
            "outputs": {
              "agents": "map[pymunk_agent]"
            }
          }
        },
        {
          "name": "AdderGrowDivide",
          "description": "Growth/division using the adder model (Taheri-Araghi et al. 2015).",
          "ports": {
            "inputs": {
              "agent_id": "string",
              "agents": "map[pymunk_agent]"
            },
            "outputs": {
              "agents": "map[pymunk_agent]"
            }
          }
        },
        {
          "name": "CellFieldExchange",
          "description": "Per-cell sampling and deposition into a 2D concentration field map.",
          "ports": {
            "inputs": {
              "agents": "map[pymunk_agent]",
              "fields": "map"
            },
            "outputs": {
              "agents": "map[pymunk_agent]",
              "fields": "map"
            }
          }
        },
        {
          "name": "QuorumSensing",
          "description": "",
          "ports": {
            "inputs": {
              "agent_id": "string",
              "agents": "map[pymunk_agent]"
            },
            "outputs": {
              "agents": "map[pymunk_agent]"
            }
          }
        },
        {
          "name": "SecreteEPS",
          "description": "",
          "ports": {
            "inputs": {
              "agent_id": "string",
              "agents": "map[pymunk_agent]"
            },
            "outputs": {
              "particles": "map[pymunk_agent]"
            }
          }
        },
        {
          "name": "DiffusionAdvection",
          "description": "Explicit finite-difference diffusion\u2013advection in 2D using a 1-cell ghost layer.",
          "ports": {
            "inputs": {
              "fields": "map"
            },
            "outputs": {
              "fields": "map"
            }
          }
        },
        {
          "name": "Chemotaxis",
          "description": "",
          "ports": {
            "inputs": {
              "agent_id": "string",
              "agents": "map[pymunk_agent]"
            },
            "outputs": {
              "agents": "map[pymunk_agent]"
            }
          }
        },
        {
          "name": "InclusionBody",
          "description": "Per-cell IB accumulator (formation + exponential growth).",
          "ports": {
            "inputs": {
              "agent_id": "string",
              "agents": "map[pymunk_agent]"
            },
            "outputs": {
              "agents": "map[pymunk_agent]"
            }
          }
        },
        {
          "name": "IBColony",
          "description": "Top-level growth + division + inclusion-body process.",
          "ports": {
            "inputs": {
              "agents": "map[pymunk_agent]"
            },
            "outputs": {
              "agents": "map[pymunk_agent]"
            }
          }
        },
        {
          "name": "PymunkProcess",
          "description": "2D rigid-body physics for colonies \u2014 a pymunk space that integrates",
          "ports": {
            "inputs": {
              "segment_cells": "map[pymunk_agent]",
              "bending_cells": "map[pymunk_agent]",
              "circle_particles": "map[pymunk_agent]"
            },
            "outputs": {
              "segment_cells": "map[pymunk_agent]",
              "bending_cells": "map[pymunk_agent]",
              "circle_particles": "map[pymunk_agent]"
            }
          }
        }
      ],
      "steps": [
        {
          "name": "Pressure",
          "description": "",
          "ports": {
            "inputs": {
              "agents": "map[pymunk_agent]"
            },
            "outputs": {
              "agents": "map[pymunk_agent]"
            }
          }
        },
        {
          "name": "RemoveCrossing",
          "description": "",
          "ports": {
            "inputs": {
              "agents": "map[pymunk_agent]"
            },
            "outputs": {
              "agents": "map[pymunk_agent]"
            }
          }
        }
      ],
      "composites": [
        {
          "name": "attachment",
          "description": "Cells settling/attaching on a surface."
        },
        {
          "name": "bending_pressure",
          "description": "Bending-pressure rod-like cells."
        },
        {
          "name": "biofilm",
          "description": "Growing biofilm with EPS secretion + pressure dynamics."
        },
        {
          "name": "chemotaxis",
          "description": "Run/tumble chemotaxis up a static 2D ligand gradient."
        },
        {
          "name": "daughter_machine",
          "description": "Daughter-machine geometry: tracking daughter cells."
        },
        {
          "name": "glucose_growth",
          "description": "Glucose-driven growth and division."
        },
        {
          "name": "inclusion_bodies",
          "description": "Inclusion-body accumulation across a growing colony."
        },
        {
          "name": "mother_machine",
          "description": "Mother-machine geometry: single-channel cell trapping."
        },
        {
          "name": "quorum_sensing",
          "description": "Quorum-sensing autoinducer feedback in a growing colony."
        }
      ],
      "studies": [
        {
          "name": "glucose-growth",
          "description": "Glucose Growth"
        },
        {
          "name": "chemotaxis",
          "description": "Chemotaxis"
        },
        {
          "name": "attachment",
          "description": "Attachment"
        },
        {
          "name": "quorum-sensing",
          "description": "Quorum Sensing"
        },
        {
          "name": "inclusion-bodies",
          "description": "Inclusion Bodies"
        },
        {
          "name": "biofilm",
          "description": "Biofilm"
        },
        {
          "name": "mother-machine",
          "description": "Mother Machine"
        },
        {
          "name": "bending-pressure",
          "description": "Bending Pressure"
        },
        {
          "name": "daughter-machine",
          "description": "Daughter Machine"
        }
      ],
      "investigations": [
        {
          "name": "composite-gallery",
          "description": "Viva-munk Composite Gallery"
        }
      ],
      "counts": {
        "processes": 11,
        "steps": 2,
        "composites": 9,
        "studies": 9,
        "investigations": 1
      },
      "attestation": {
        "pinned_ref": false,
        "has_lockfile": false,
        "has_license": true,
        "has_citation": false,
        "schema_version_present": true,
        "studies_total": 9,
        "studies_with_acceptance_criteria": 0,
        "studies_with_baseline": 9,
        "score": 0.35
      }
    },
    {
      "name": "pbg-amici",
      "repo": "pbg-amici",
      "source": "https://github.com/vivarium-collective/pbg-amici",
      "homepage": "https://github.com/vivarium-collective/pbg-amici",
      "description": "Process-bigraph wrapper for AMICI (CVODES-based ODE/DAE simulator). Real bridge to https://github.com/AMICI-dev/AMICI.",
      "tags": [
        "ode"
      ],
      "cloned": true,
      "processes": [
        {
          "name": "AmiciProcess",
          "description": "Time-stepped ODE simulation via AMICI.",
          "ports": {
            "inputs": {
              "states": "map[string,float]",
              "parameters": "map[string,float]",
              "fixed_parameters": "map[string,float]"
            },
            "outputs": {
              "states": "map[string,float]",
              "observables": "map[string,float]"
            }
          }
        }
      ],
      "steps": [
        {
          "name": "AmiciUTCStep",
          "description": "One-shot uniform time course via AMICI.",
          "ports": {
            "inputs": {
              "model_source": "string",
              "time": "float",
              "n_points": "integer"
            },
            "outputs": {
              "result": "tree"
            }
          }
        },
        {
          "name": "AmiciSteadyStateStep",
          "description": "One-shot steady-state solve via AMICI.",
          "ports": {
            "inputs": {
              "model_source": "string"
            },
            "outputs": {
              "result": "tree"
            }
          }
        }
      ],
      "composites": [
        {
          "name": "amici_mapk_cascade",
          "description": "Three-tier MAPK signaling cascade (KKK\u2192KK\u2192K) with explicit phosphatases, simulated by AMICI (CVODES). Demonstrates a biologically flavored multi-species model and observable expressions."
        },
        {
          "name": "amici_lotka_volterra",
          "description": "Classical Lotka-Volterra predator-prey ODE solved by AMICI (CVODES). Demonstrates two coupled nonlinear species and observable expressions (ratio, total)."
        },
        {
          "name": "amici_exponential_decay",